{
  "content": {
    "drs_hit_is_authority": false,
    "drs_record_is_truth": false,
    "drs_reuse_candidate_is_action_permission": false,
    "kind": "pointer",
    "record": {
      "artifact_pointers": [],
      "authority_envelope": {
        "action_permission_present": false,
        "authority_class": "ROOT_ACCEPTED_CONTEXT",
        "authority_envelope_id": "drsauth_v01:e776108c44ef019cb436e4e27c9446107eb3bd75d2cdd81c4332a6e34f138a76",
        "authority_envelope_version": "v0.1",
        "authority_scope_fingerprint": "babc696d847a13ba626f7627aba5464ca64d9d405a20cb461f34aa780f91def8",
        "creates_authority": false,
        "creates_permission": false,
        "owning_local_root_id": "ActivePlanetRoot",
        "recording_component": "football:connector",
        "root_acceptance_state": "ACCEPTED_CONTEXT",
        "source_root_decision_hash": "f540b46fba53c2fc9c723f42650cd61e55ef9054218ef41a7123b9942ac861c4",
        "source_root_decision_id": "2fb8f6d1c7d0a2a6d0f47ebcd2650b1fd5197f4d00da3e59e08347f288160fca",
        "source_root_decision_input_id": "4df5744976bac9d8deb4e5b2f4ac71228356bbade64f0bcaaca7bbce25bf9011"
      },
      "conflict_hints": [],
      "content_fingerprint": "babc696d847a13ba626f7627aba5464ca64d9d405a20cb461f34aa780f91def8",
      "creates_authority": false,
      "creates_permission": false,
      "lineage_edges": [],
      "local_reference_kernel_scope": "LOCAL_REFERENCE_KERNEL",
      "meaning_record_id": "drsmeaning_v01:57855414bbda3d8fb97bec3ff0d4212f84a3e16cf879eabca27f0df67f6685e8",
      "meaning_record_version": "v0.1",
      "memory_pointers": [],
      "persistent_lifecycle_state": "ACTIVE",
      "policy_version": "football.pointer.context.v01",
      "predecessor_record_id": null,
      "recording_component": "football:connector",
      "resonance_reason": "Foreign metadata retained for local context review.",
      "reuse_policy_class": "CONTEXT_ONLY",
      "risk_hints": [],
      "safe_summary": "Bounded synthetic football venue offer metadata.",
      "schema_versions": [
        "football.pointer.context.v01"
      ],
      "semantic_address": {
        "address_profile_version": "v0.1",
        "domain": "FOOTBALL",
        "intent_class": "context_lookup",
        "meaning_schema_id": "football.pointer_metadata",
        "meaning_schema_version": "v01",
        "namespace": "football",
        "semantic_address_id": "drsaddr_v01:78ab1ccfb9d2441ee05236ed8782437b344a132092f11365a6313281362c92f8",
        "subject_class": "external_pointer"
      },
      "semantic_tags": [
        "football",
        "pointer"
      ],
      "source_reference_ids": [
        "8ed641c66d9f8bb3b4cd85f06e1825899962368faabe61d862d569fa178825e7"
      ],
      "supersession_reason": null,
      "time_envelope": {
        "ct_context_anchor": 1790359281,
        "et_observed_at": 1790359281,
        "freshness_policy_id": "freshness:football:source",
        "kt_as_of": 1790359281,
        "pt_created_at": 1790359281,
        "source_observed_at": 1790359281,
        "source_reported_at": 1790359281,
        "system_ingested_at": 1790359281,
        "system_verified_at": 1790359281,
        "time_envelope_id": "drstime_v01:f27ee471346bd64e4f037da53e49edecae52cd6ab415be57d8cd4ea3300eb6b3",
        "time_envelope_version": "v0.1",
        "ttl_seconds": 300,
        "valid_from": 1790359281,
        "valid_to": 1790359581
      }
    },
    "semantic_keys": [
      "football",
      "pointer"
    ]
  },
  "domain": "FOOTBALL",
  "layer": "work",
  "provenance": {
    "created_by": "root_orchestrator",
    "request_id": "req:drsmeaning_v01:57855414bbda3d8fb97bec3ff0d4212f84a3e16cf879eabca27f0df67f6685e8",
    "trace_refs": [
      {
        "kind": "local_drs_resolver",
        "trace_id": "trace:drsmeaning_v01:57855414bbda3d8fb97bec3ff0d4212f84a3e16cf879eabca27f0df67f6685e8"
      }
    ]
  },
  "record_id": "drsmeaning_v01:57855414bbda3d8fb97bec3ff0d4212f84a3e16cf879eabca27f0df67f6685e8",
  "status": "active",
  "time_envelope": {
    "ct_session_anchor": "football:session",
    "et_observed_at": "2026-09-25T18:01:21+00:00",
    "freshness_class": "static",
    "kt_asof": "2026-09-25T18:01:21+00:00",
    "pt_created_at": "2026-09-25T18:01:21+00:00",
    "ttl_seconds": 300,
    "valid_from": "2026-09-25T18:01:21+00:00",
    "valid_to": "2026-09-25T18:06:21+00:00"
  },
  "trace_refs": [
    {
      "kind": "local_drs_resolver",
      "trace_id": "trace:drsmeaning_v01:57855414bbda3d8fb97bec3ff0d4212f84a3e16cf879eabca27f0df67f6685e8"
    }
  ],
  "type": "generic"
}